Symbol,Name,Last Sale,Net Change,% Change,Market Cap,Country,IPO Year,Volume,Sector,Industry
ACU,Acme United Corporation. Common Stock,$40.35,-1.47,-3.515%,149091878.00,United States,1988,20607,Consumer Discretionary,Industrial Machinery/Components
ADRT,Ault Disruptive Technologies Corporation Common Stock,$11.16,-0.63,-5.344%,160425000.00,,2022,5353,Finance,Blank Checks
AE,Adams Resources & Energy Inc. Common Stock,$25.65,-0.32,-1.232%,65861505.00,United States,1980,5801,Energy,Oil Refining/Marketing
AEF,abrdn Emerging Markets Equity Income Fund Inc. Common Stock,$5.76,0.055,0.964%,618408000.00,United States,,82035,Finance,Finance/Investors Services
AEON,AEON Biopharma Inc. Class A Common Stock,$0.9277,0.0694,8.086%,36664780.00,United States,,373069,Health Care,Biotechnology: Pharmaceutical Preparations
AIM,AIM ImmunoTech Inc. Common Stock,$0.28,0.01,3.704%,15998270.00,United States,1997,125067,Health Care,Biotechnology: Biological Products (No Diagnostic Substances)
AIRI,Air Industries Group Common Stock,$5.53,-0.28,-4.819%,18453815.00,United States,,121945,Industrials,Military/Government/Technical
AMBI,Ambipar Emergency Response Class A Ordinary Shares,$5.4473,0.8373,18.163%,301943027.00,,,47825,Industrials,Environmental Services
AMBO,Ambow Education Holding Ltd. American Depository Shares (each representing twenty (20) Class A Ordinary Shares),$1.09,0.00,0.00%,3113450.00,China,,500,Real Estate,Other Consumer Services
AMS,American Shared Hospital Services Common Stock,$3.06,0.00,0.00%,19461600.00,United States,1988,15920,Health Care,Medical Specialities
APT,Alpha Pro Tech Ltd. Common Stock,$5.69,0.04,0.708%,63578353.00,Canada,2000,40032,Health Care,Industrial Specialties
AREN,The Arena Group Holdings Inc. Common Stock,$0.75,0.035,4.895%,22193723.00,United States,2022,25317,Technology,EDP Services
ARMN,Aris Mining Corporation Common Shares,$4.69,-0.23,-4.675%,798758787.00,,2023,625411,,
ARMP,Armata Pharmaceuticals Inc. Common Stock,$2.36,0.07,3.057%,85392038.00,United States,,4020,Health Care,Biotechnology: Biological Products (No Diagnostic Substances)
ASM,Avino Silver & Gold Mines Ltd. Common Shares (Canada),$1.16,-0.02,-1.695%,156721570.00,Canada,,1366083,Basic Materials,Metal Mining
ATCH,AtlasClear Holdings Inc. Common Stock,$0.255,-0.038,-12.969%,3176065.00,,2024,2587768,Finance,Finance: Consumer Services
ATEK,Athena Technology Acquisition Corp. II Class A Common Stock,$11.56,0.00,0.00%,0.00,,2022,1,Finance,Blank Checks
ATNM,Actinium Pharmaceuticals Inc. (Delaware) Common Stock,$1.80,0.01,0.559%,56077877.00,United States,,240123,Health Care,Biotechnology: Pharmaceutical Preparations
AUMN,Golden Minerals Company Common Stock,$0.2893,0.0123,4.44%,4349639.00,United States,,1520221,Basic Materials,Precious Metals
AUST,Austin Gold Corp. Common Shares,$1.1396,-0.0004,-0.035%,15124486.00,,2022,44750,Basic Materials,Precious Metals
AWX,Avalon Holdings Corporation Common Stock,$2.5484,-0.0515,-1.981%,9937310.00,United States,1998,938,Utilities,Environmental Services
AXIL,AXIL Brands Inc. Common Stock,$4.45,-0.03,-0.67%,28453029.00,,2024,1806,Consumer Discretionary,Package Goods/Cosmetics
AZTR,Azitra Inc Common Stock,$0.55,-0.0062,-1.115%,4193781.00,,2023,118205,Health Care,Biotechnology: Pharmaceutical Preparations
BACA,Berenson Acquisition Corp. I Class A Common Stock,$10.64,0.00,0.00%,0.00,,2021,4033,Finance,Blank Checks
BATL,Battalion Oil Corporation Common Stock,$6.71,0.05,0.751%,110423538.00,United States,,22754,Energy,Oil & Gas Production
BCV,Bancroft Fund Ltd.,$16.64,0.16,0.971%,0.00,United States,1972,20384,Finance,Finance/Investors Services
BCV^A,Bancroft Fund Limited 5.375% Series A Cumulative Preferred Shares,$23.98,0.07,0.293%,,United States,,3276,,
BDL,Flanigan's Enterprises Inc. Common Stock,$27.50,0.00,0.00%,51112793.00,United States,1972,73,Consumer Discretionary,Restaurants
BEEP,Mobile Infrastructure Corporation Common Stock,$3.45,0.03,0.877%,0.00,,2023,65972,Finance,Blank Checks
BGI,Birks Group Inc. Common Stock,$2.1899,-0.0108,-0.491%,41971556.00,Canada,,4984,Consumer Discretionary,Consumer Specialties
BHB,Bar Harbor Bankshares Inc. Common Stock,$30.20,0.19,0.633%,461066601.00,United States,1997,34583,Finance,Major Banks
BHM,Bluerock Homes Trust Inc. Class A Common Stock,$14.75,0.10,0.683%,58331102.00,,2022,1418,Real Estate,Real Estate Investment Trusts
BKTI,BK Technologies Corporation Common Stock,$22.84,-0.60,-2.56%,80784075.00,United States,,30725,Technology,Radio And Television Broadcasting And Communications Equipment
BMTX,BM Technologies Inc. Common Stock,$3.43,0.10,3.003%,41501851.00,,2018,53863,Finance,Major Banks
BQ,Boqii Holding Limited American Depositary Shares representing Class A Ordinary Shares,$0.393,-0.017,-4.146%,2557706.00,,2020,1533322,Consumer Discretionary,Other Specialty Stores
BRBS,Blue Ridge Bankshares Inc. Common Stock,$2.79,0.00,0.00%,205071643.00,United States,,305790,Finance,Major Banks
BRN,Barnwell Industries Inc. Common Stock,$2.22,0.02,0.909%,22262360.00,United States,1965,21595,Energy,Oil & Gas Production
BTG,B2Gold Corp Common shares (Canada),$3.20,-0.13,-3.904%,4194553312.00,Canada,,12186103,Basic Materials,Precious Metals
BTTR,Better Choice Company Inc. Common Stock,$2.18,0.06,2.83%,3608617.00,,2021,33419,Consumer Staples,Beverages (Production/Distribution)
BURU,Nuburu Inc. Common Stock,$0.504,0.003,0.599%,1849680.00,United States,,221197,Miscellaneous,Industrial Machinery/Components
CANF,Can-Fite Biopharma Ltd Sponsored ADR (Israel),$2.02,-0.03,-1.463%,11251400.00,Israel,,12909,Health Care,Biotechnology: Pharmaceutical Preparations
CATX,Perspective Therapeutics Inc. Common Stock,$12.57,0.31,2.529%,847595100.00,United States,,484139,Health Care,Medical/Dental Instruments
CCEL,Cryo-Cell International Inc. Common Stock,$6.48,-0.05,-0.766%,52240373.00,United States,2022,1026,Health Care,Misc Health and Biotechnology Services
CET,Central Securities Corporation Common Stock,$45.80,0.00,0.00%,11084754160.00,United States,1951,23727,Finance,Finance/Investors Services
CEV,Eaton Vance California Municipal Income Trust Shares of Beneficial Interest,$10.82,0.04,0.371%,76103282.00,United States,1999,35526,Finance,Finance/Investors Services
CHEB,Chenghe Acquisition II Co. Class A Ordinary Shares,$10.02,0.005,0.05%,0.00,,2024,18714,,
CHRO,Chromocell Therapeutics Corporation Common Stock,$0.84,-0.18,-17.647%,4844031.00,,2024,683057,Health Care,Biotechnology: Biological Products (No Diagnostic Substances)
CIK,Credit Suisse Asset Management Income Fund Inc. Common Stock,$3.08,0.00,0.00%,0.00,United States,,446654,Finance,Finance/Investors Services
CIX,CompX International Inc. Common Stock,$29.64,0.61,2.101%,365122029.00,United States,1998,3873,Consumer Discretionary,Industrial Machinery/Components
CKX,CKX Lands Inc. Common Stock,$13.66,0.16,1.185%,27689257.00,United States,2003,1070,Energy,Oil & Gas Production
CLDI,Calidi Biotherapeutics Inc. Common Stock,$1.21,0.00,0.00%,11959825.00,,2021,93320,Health Care,Biotechnology: Biological Products (No Diagnostic Substances)
CLM,Cornerstone Strategic Value Fund Inc. New Common Stock,$7.63,0.00,0.00%,0.00,United States,2003,1205787,Finance,Finance/Investors Services
CMCL,Caledonia Mining Corporation Plc Common Shares,$15.02,-0.16,-1.054%,288204856.00,Canada,,112458,Basic Materials,Precious Metals
CMT,Core Molding Technologies Inc Common Stock,$17.93,0.03,0.168%,162599137.00,United States,1996,20413,Industrials,Plastic Products
CNL,Collective Mining Ltd. Common Shares,$3.25,-0.06,-1.813%,221805587.00,,2024,3842,,
COE,51Talk Online Education Group American depositary shares each representing 60 Class A ordinary shares,$16.70,0.4788,2.952%,95551889.00,China,2016,10716,Real Estate,Other Consumer Services
COHN,Cohen & Company Inc.,$8.25,-0.1866,-2.212%,16088754.00,United States,,9331,Finance,Investment Bankers/Brokers/Service
CPHI,China Pharma Holdings Inc. Common Stock,$0.235,-0.009,-3.689%,4033251.00,China,,1717789,Health Care,Biotechnology: Pharmaceutical Preparations
CRF,Cornerstone Total Return Fund Inc. (The) Common Stock,$7.97,0.00,0.00%,0.00,United States,2003,474298,Finance,Finance/Investors Services
CTGO,Contango ORE Inc. Common Stock,$19.52,0.02,0.103%,237078364.00,United States,2021,88908,Basic Materials,Precious Metals
CTM,Castellum Inc. Common Stock,$0.1725,-0.0015,-0.862%,9678963.00,,2022,105994,Consumer Discretionary,Professional Services
CVM,Cel-Sci Corporation Common Stock,$1.09,0.04,3.81%,67027620.00,United States,1997,293709,Health Care,Biotechnology: Biological Products (No Diagnostic Substances)
CVR,Chicago Rivet & Machine Co. Common Stock,$18.0177,-0.9923,-5.22%,17407477.00,United States,1930,1105,Industrials,Industrial Machinery/Components
CVU,CPI Aerostructures Inc. Common Stock,$3.39,0.00,0.00%,44194149.00,United States,2022,54126,Industrials,Military/Government/Technical
CYBN,Cybin Inc. Common Shares,$9.60,-0.28,-2.834%,191922317.00,Canada,,329482,Health Care,Biotechnology: Pharmaceutical Preparations
DC,Dakota Gold Corp. Common Stock,$2.38,-0.05,-2.058%,222916671.00,United States,2022,79025,Basic Materials,Metal Mining
DDC,DDC Enterprise Limited Class A Ordinary Shares,$0.3281,0.024,7.892%,7077117.00,,2023,634109,Consumer Staples,Packaged Foods
DHY,Credit Suisse High Yield Bond Fund Common Stock,$2.21,0.00,0.00%,0.00,United States,1998,222853,Finance,Finance/Investors Services
DIT,AMCON Distributing Company Common Stock,$146.80,-1.09,-0.737%,92537142.00,United States,1999,81,Consumer Discretionary,Food Distributors
DMF,BNY Mellon Municipal Income Inc. Common Stock,$7.32,0.02,0.274%,455969051.00,United States,1988,384281,Finance,Finance/Investors Services
DNN,Denison Mines Corp Ordinary Shares (Canada),$1.87,0.01,0.538%,1668731775.00,Canada,,13636159,Basic Materials,Other Metals and Minerals
DSS,DSS Inc. Common Stock,$1.31,0.09,7.377%,9257471.00,United States,,7712,Consumer Discretionary,Containers/Packaging
EAD,Allspring Income Opportunities Fund Common Shares,$7.11,0.02,0.282%,0.00,United States,2003,94215,Finance,Finance/Investors Services
ECF,Ellsworth Growth and Income Fund Ltd.,$8.94,0.09,1.017%,0.00,United States,1986,44292,Finance,Finance/Investors Services
ECF^A,Ellsworth Growth and Income Fund Ltd. 5.25% Series A Cumulative Preferred Shares (Liquidation Preference $25.00 per share),$23.56,0.03,0.127%,,United States,,2994,,
EFSH,1847 Holdings LLC Common Shares,$1.90,-0.08,-4.04%,1301145.00,,2022,33793,Consumer Discretionary,Professional Services
EIM,Eaton Vance Municipal Bond Fund Common Shares of Beneficial Interest $.01 par value,$10.70,0.06,0.564%,0.00,United States,2002,130668,Finance,Finance/Investors Services
ELA,Envela Corporation Common Stock,$5.44,-0.16,-2.857%,141844682.00,United States,,15327,Consumer Discretionary,Consumer Specialties
ELLO,Ellomay Capital Ltd Ordinary Shares (Israel),$12.01,0.00,0.00%,154359546.00,Israel,,8,Utilities,Electric Utilities: Central
ELMD,Electromed Inc. Common Stock,$20.30,0.78,3.996%,175370015.00,United States,2011,139348,Health Care,Biotechnology: Electromedical & Electrotherapeutic Apparatus
EMX,EMX Royalty Corporation Common Shares (Canada),$1.80,-0.08,-4.255%,204349135.00,Canada,,433376,Basic Materials,Metal Mining
ENSV,Enservco Corporation Common Stock,$0.128,-0.0018,-1.387%,5867761.00,United States,,220806,Energy,Oilfield Services/Equipment
ENX,Eaton Vance New York Municipal Bond Fund Common Shares of Beneficial Interest $.01 par value,$9.88,0.02,0.203%,0.00,United States,2002,57959,Finance,Finance/Investors Services
EONR,EON Resources Inc. Class A Common Stock,$0.95,-0.02,-2.062%,7017659.00,,2022,370220,Energy,Oil & Gas Production
EP,Empire Petroleum Corporation Common Stock,$5.10,0.09,1.796%,160046400.00,United States,2022,18952,Energy,Oil & Gas Production
EPM,Evolution Petroleum Corporation Inc. Common Stock,$5.33,0.19,3.696%,177610311.00,United States,,270737,Energy,Oil & Gas Production
EQX,Equinox Gold Corp. Common Shares,$6.14,-0.32,-4.954%,2631021455.00,Canada,,2869264,Basic Materials,Precious Metals
ERC,Allspring Multi-Sector Income Fund Common Stock,$9.515,0.03,0.316%,0.00,United States,2003,74333,Finance,Finance/Investors Services
ERH,Allspring Utilities and High Income Fund Common Shares,$11.06,0.035,0.317%,0.00,,2004,41276,Finance,Finance/Investors Services
ESP,Espey Mfg. & Electronics Corp. Common Stock,$24.81,0.565,2.33%,67799825.00,United States,1960,24337,Technology,Industrial Machinery/Components
EVBN,Evans Bancorp Inc. Common Stock,$37.99,-0.36,-0.939%,209926586.00,United States,,35382,Finance,Major Banks
EVE,EVe Mobility Acquisition Corp Class A Ordinary Shares,$11.06,0.03,0.272%,0.00,,2022,1105,Finance,Blank Checks
EVI,EVI Industries Inc.  Common Stock,$19.61,0.36,1.87%,248733966.00,United States,1999,5047,Consumer Discretionary,Other Consumer Services
EVM,Eaton Vance California Municipal Bond Fund Common Shares of Beneficial Interest $.01 par value,$9.60,0.02,0.209%,0.00,United States,2002,35130,Finance,Finance/Investors Services
EVV,Eaton Vance Limited Duration Income Fund Common Shares of Beneficial Interest,$10.32,-0.04,-0.386%,0.00,United States,2003,322085,Finance,Finance/Investors Services
FAX,abrdn Asia-Pacific Income Fund Inc. Common Stock,$17.49,0.18,1.04%,0.00,United States,1986,157785,Finance,Investment Managers
FCO,abrdn Global Income Fund Inc. Common Stock,$5.98,0.0942,1.60%,0.00,United States,1992,46636,Finance,Investment Managers
FLYX,flyExclusive Inc. Class A Common Stock,$2.94,0.16,5.755%,228818983.00,,2023,12683,Consumer Discretionary,Transportation Services
FOXO,FOXO Technologies Inc. Class A Common Stock,$0.19,-0.0081,-4.089%,2589995.00,,2022,141023,Finance,Life Insurance
FRD,Friedman Industries Inc. Common Stock,$15.68,-0.44,-2.73%,109284818.00,United States,1975,6229,Industrials,Steel/Iron Ore
FSI,Flexible Solutions International Inc. Common Stock (CDA),$3.65,-0.03,-0.815%,45444442.00,Canada,2002,3795,Industrials,Major Chemicals
FSP,Franklin Street Properties Corp. Common Stock,$1.70,-0.02,-1.163%,176063416.00,United States,,765550,Real Estate,Real Estate Investment Trusts
FTF,Franklin Limited Duration Income Trust Common Shares of Beneficial Interest,$6.68,-0.01,-0.149%,269907898.00,United States,2003,160339,Finance,Finance/Investors Services
FURY,Fury Gold Mines Limited Common Shares,$0.4478,-0.0122,-2.652%,67821940.00,,2020,130597,Basic Materials,Precious Metals
GAU,Galiano Gold Inc.,$1.43,-0.05,-3.378%,367394808.00,Canada,,503941,Industrials,Mining & Quarrying of Nonmetallic Minerals (No Fuels)
GBR,New Concept Energy Inc Common Stock,$1.14,-0.01,-0.87%,5850405.00,United States,1993,5068,Energy,Oil & Gas Production
GENC,Gencor Industries Inc. Common Stock,$20.92,0.14,0.674%,306639126.00,United States,,18031,Industrials,Construction/Ag Equipment/Trucks
GGN,GAMCO Global Gold Natural Resources & Income Trust,$4.295,-0.01,-0.232%,0.00,United States,2005,247662,Finance,Finance/Investors Services
GGN^B,GAMCO Global Gold Natural Reources & Income Trust 5.00% Series B Cumulative 25.00 Liquidation Preference,$23.40,-0.19,-0.805%,,United States,,528,,
GLDG,GoldMining Inc. Common Shares,$0.9518,-0.0448,-4.495%,179628822.00,,,712814,Basic Materials,Precious Metals
GLO,Clough Global Opportunities Fund Common Stock,$5.45,0.03,0.554%,0.00,United States,2006,135966,Finance,Finance/Investors Services
GLQ,Clough Global Equity Fund Clough Global Equity Fund Common Shares of Beneficial Interest,$6.93,-0.022,-0.316%,0.00,United States,2005,63791,Finance,Finance/Investors Services
GLU,Gabelli Global Utility Common Shares of Beneficial Ownership,$16.46,0.0399,0.243%,98248275.00,United States,2004,12828,Finance,Finance/Investors Services
GLU^A,The Gabelli Global Utility and Income Trust Series A Cumulative Puttable and Callable Preferred Shares,$53.90,0.00,0.00%,,United States,,9,,
GLU^B,The Gabelli Global Utility and Income Trust Series B Cumulative Puttable and Callable Preferred Shares,$50.05,-0.1826,-0.364%,,United States,,6093,,
GLV,Clough Global Dividend and Income Fund Common Shares of beneficial interest,$5.885,0.03,0.512%,74795896.00,United States,2004,21019,Finance,Finance/Investors Services
GNS,Genius Group Limited Ordinary Shares,$0.9501,0.0195,2.095%,20625692.00,Singapore,2022,258567,Consumer Discretionary,Services-Misc. Amusement & Recreation
GORO,Gold Resource Corporation Common Stock,$0.3658,-0.0068,-1.825%,34210724.00,United States,,412662,Basic Materials,Precious Metals
GPUS,Hyperscale Data Inc. Common Stock,$0.222,0.0031,1.416%,8623883.00,United States,1997,532670,Technology,Industrial Machinery/Components
GPUS^D,Hyperscale Data Inc. 13.00% Series D Cumulative Redeemable Perpetual Preferred Stock,$21.20,-1.58,-6.936%,,United States,,2495,,
GRAF,Graf Global Corp. Class A ordinary shares,$10.01,0.00,0.00%,0.00,,2024,174,,
GRF,Eagle Capital Growth Fund Inc. Common Stock,$9.82,-0.03,-0.305%,0.00,United States,,2104,Finance,Finance/Investors Services
GRFX,Graphex Group Limited American Depositary Shares each American Depositary Share representing 20 Ordinary Shares,$0.1724,-0.0244,-12.398%,134031846.00,,2022,146073,,
GROY,Gold Royalty Corp. Common Shares,$1.38,-0.05,-3.497%,233318555.00,Canada,2021,650304,Basic Materials,Precious Metals
GSAT,Globalstar Inc. Common Stock,$1.23,0.03,2.50%,2337000000.00,United States,2006,2683512,Consumer Discretionary,Telecommunications Equipment
GTE,Gran Tierra Energy Inc. Common Stock,$6.16,-0.16,-2.532%,189422057.00,Canada,,257094,Energy,Oil & Gas Production
HCWC,Healthy Choice Wellness Corp. Class A Common Stock,$2.57,-0.07,-2.652%,25186000.00,,2024,62450,Consumer Staples,Food Chains
HNW,Pioneer Diversified High Income Fund Inc.,$12.24,0.02,0.164%,0.00,United States,2007,13336,Finance,Finance/Investors Services
HUSA,Houston American Energy Corporation Common Stock,$1.09,0.06,5.825%,11887925.00,United States,,307355,Energy,Oil & Gas Production
HWM^,Howmet Aerospace Inc. $3.75 Preferred Stock,$67.9999,0.5999,0.89%,,United States,,635,,
IAF,abrdn Australia Equity Fund Inc. Common Stock,$4.69,0.01,0.214%,0.00,United States,1985,131790,Finance,Finance/Investors Services
IAUX,i-80 Gold Corp. Common Shares,$1.18,-0.01,-0.84%,454178136.00,Canada,2022,3845567,Basic Materials,Precious Metals
IBIO,iBio Inc. Common Stock,$2.08,0.13,6.667%,17966822.00,United States,,59200,Health Care,Biotechnology: Pharmaceutical Preparations
IBO,Impact BioMedical Inc. Common Stock,$1.965,-0.425,-17.782%,22592986.00,,2024,212207,Health Care,Biotechnology: Pharmaceutical Preparations
IDR,Idaho Strategic Resources Inc. Common Stock,$14.92,-0.68,-4.359%,193341924.00,,2022,245528,Basic Materials,Precious Metals
IE,Ivanhoe Electric Inc. Common Stock,$8.71,-0.11,-1.247%,1047868866.00,Canada,2022,508944,Basic Materials,Metal Mining
IGC,IGC Pharma Inc. Common Stock,$0.3541,0.0041,1.171%,26782856.00,United States,,2413749,Health Care,Biotechnology: Pharmaceutical Preparations
IHT,InnSuites Hospitality Trust Shares of Beneficial Interest,$1.83,0.02,1.105%,16057562.00,United States,1999,2974,Finance,Investment Bankers/Brokers/Service
IMO,Imperial Oil Limited Common Stock,$70.29,1.61,2.344%,37663968883.00,Canada,1929,432976,Energy,Integrated oil Companies
INDO,Indonesia Energy Corporation Limited Ordinary Shares,$2.47,0.04,1.646%,25200654.00,,2019,732457,Energy,Oil & Gas Production
INFU,InfuSystems Holdings Inc. Common Stock,$6.75,0.19,2.896%,143879139.00,United States,,49509,Health Care,Medical/Dental Instruments
INLX,Intellinetics Inc. Common Stock,$11.49,-0.11,-0.948%,48611961.00,,2022,4288,Technology,Computer Software: Prepackaged Software
INTT,inTest Corporation Common Stock,$7.03,0.01,0.142%,87989448.00,United States,1997,28903,Industrials,Electrical Products
INUV,Inuvo Inc.,$0.2499,-0.002,-0.794%,35093979.00,United States,,233569,Consumer Discretionary,Advertising
IOR,Income Opportunity Realty Investors Inc. Common Stock,$18.00,0.00,0.00%,73191204.00,United States,1987,58,Real Estate,Real Estate Investment Trusts
ISDR,Issuer Direct Corporation Common Stock,$11.39,0.155,1.38%,43668998.00,United States,,25680,Consumer Discretionary,Publishing
ITP,IT Tech Packaging Inc. Common Stock,$0.249,-0.036,-12.632%,2506414.00,China,,236565,Consumer Discretionary,Containers/Packaging
ITRG,Integra Resources Corp. Common Shares,$0.97,-0.0499,-4.893%,85804941.00,,,174534,Basic Materials,Precious Metals
JOB,GEE Group Inc. Common Stock,$0.267,0.014,5.534%,29042011.00,United States,1968,111501,Consumer Discretionary,Diversified Commercial Services
JWSM,Jaws Mustang Acquisition Corp. Class A Ordinary Shares,$11.30,0.04,0.355%,0.00,,2021,5031,Finance,Blank Checks
KAPA,Kairos Pharma Ltd. Common Stock,$1.54,-0.115,-6.949%,19776583.00,,2024,92212,Health Care,Biotechnology: Pharmaceutical Preparations
KNW,Know Labs Inc. Common Stock,$0.32,0.0346,12.123%,33913600.00,,2022,486645,Industrials,Industrial Machinery/Components
KULR,KULR Technology Group Inc. Common Stock,$0.28,-0.004,-1.408%,54037093.00,United States,,1489671,Technology,Electrical Products
LCTX,Lineage Cell Therapeutics Inc. Common Stock,$0.92,0.0582,6.753%,173730385.00,United States,,395587,Health Care,Biotechnology: Biological Products (No Diagnostic Substances)
LEGT,Legato Merger Corp. III Ordinary Shares,$10.209,0.004,0.039%,0.00,,2024,3046,,
LEU,Centrus Energy Corp. Class A Common Stock,$57.72,2.93,5.348%,939678368.00,United States,2014,328683,Industrials,Mining & Quarrying of Nonmetallic Minerals (No Fuels)
LGCY,Legacy Education Inc.,$4.39,0.37,9.204%,49901841.00,,2024,278948,,
LGL,LGL Group Inc. (The) Common Stock,$6.04,0.28,4.861%,32453252.00,United States,1946,3073,Technology,Industrial Machinery/Components
LODE,Comstock Inc. Common Stock,$0.4874,-0.1301,-21.069%,85433289.00,United States,,12433294,Industrials,Major Chemicals
LPA,Logistic Properties of the Americas Ordinary Shares,$9.83,-0.38,-3.722%,311706813.00,,2024,36174,Finance,Real Estate
LSF,Laird Superfood Inc. Common Stock,$4.93,0.00,0.00%,50553413.00,,2020,65933,Consumer Staples,Packaged Foods
LXFR,Luxfer Holdings PLC Ordinary Shares,$12.88,0.17,1.338%,352740400.00,United Kingdom,2012,59735,Industrials,Major Chemicals
MAG,MAG Silver Corporation Ordinary Shares,$14.59,-0.67,-4.391%,1505361403.00,Canada,,713612,Basic Materials,Precious Metals
MAIA,MAIA Biotechnology Inc. Common Stock,$2.61,0.00,0.00%,62397823.00,,2022,95755,Health Care,Biotechnology: Pharmaceutical Preparations
MGLD,The Marygold Companies Inc. Common Stock,$1.45,0.005,0.346%,58139418.00,,2022,15230,Finance,Finance: Consumer Services
MHH,Mastech Digital Inc Common Stock,$10.10,-0.10,-0.98%,117993048.00,United States,,2227,Consumer Discretionary,Professional Services
MI,NFT Limited Class A Ordinary Share,$7.72,0.01,0.13%,23854862.00,,2023,5769,Consumer Discretionary,Other Specialty Stores
MITQ,Moving iMage Technologies Inc. Common Stock,$0.578,0.0081,1.421%,5887144.00,United States,2021,277175,Consumer Discretionary,Industrial Machinery/Components
MLSS,Milestone Scientific Inc. Common Stock,$0.9213,-0.0287,-3.021%,71205171.00,United States,2015,36657,Health Care,Industrial Specialties
MMA,Alta Global Group Limited Ordinary Shares,$1.94,0.185,10.541%,19919311.00,,2024,21812,Consumer Discretionary,Other Consumer Services
MPTI,M-tron Industries Inc. Common Stock,$41.02,2.66,6.934%,115207911.00,,2022,51299,Technology,Industrial Machinery/Components
MPU,Mega Matrix Corp. Common Stock,$1.03,0.01,0.98%,39708380.00,United States,1998,50332,Consumer Discretionary,Diversified Commercial Services
MRT,Marti Technologies Inc. Class A Ordinary Shares,$1.97,-0.09,-4.369%,112361105.00,,2021,39203,Consumer Discretionary,Rental/Leasing Companies
MSN,Emerson Radio Corporation Common Stock,$0.5011,0.0001,0.02%,10544473.00,United States,1994,904,Consumer Staples,Consumer Electronics/Appliances
MTA,Metalla Royalty & Streaming Ltd. Common Shares,$3.19,-0.16,-4.776%,292678640.00,,,294488,Basic Materials,Precious Metals
MTNB,Matinas Biopharma Holdings Inc. Common Stock,$3.57,0.00,0.00%,17908273.00,United States,2017,63024,Health Care,Biotechnology: Pharmaceutical Preparations
MWG,Multi Ways Holdings Limited Ordinary Shares,$0.4298,-0.1428,-24.939%,13255032.00,,2023,4024867,Consumer Discretionary,Miscellaneous manufacturing industries
MXC,Mexco Energy Corporation Common Stock,$12.43,-1.0777,-7.978%,25922056.00,United States,2003,11458,Energy,Oil & Gas Production
MYND,Mynd.ai Inc. American Depositary Shares,$0.85,-0.0201,-2.31%,38800615.00,,2017,91639,Real Estate,Other Consumer Services
MYO,Myomo Inc. Common Stock,$3.90,0.19,5.121%,117880433.00,United States,2017,99187,Health Care,Industrial Specialties
NAK,Northern Dynasty Minerals Ltd. Common Stock,$0.3322,-0.0103,-3.007%,178632006.00,Canada,,679398,Basic Materials,Precious Metals
NBH,Neuberger Berman Municipal Fund Inc. Common Stock,$11.14,-0.06,-0.536%,0.00,United States,2002,105746,Finance,Finance/Investors Services
NBY,NovaBay Pharmaceuticals Inc. Common Stock,$0.71,-0.02,-2.74%,3468842.00,United States,2007,321922,Health Care,Biotechnology: Pharmaceutical Preparations
NCL,Northann Corp. Common Stock,$0.176,0.001,0.571%,4266240.00,,2023,93334,Industrials,Plastic Products
NEN,New England Realty Associates Limited Partnership Class A Depositary Receipts Evidencing Units of Limited Partnership,$83.00,0.00,0.00%,9612479.00,United States,,179,Real Estate,Building operators
NEWP,New Pacific Metals Corp. Common Shares,$1.49,-0.07,-4.487%,255184281.00,Canada,2021,422556,Basic Materials,Precious Metals
NFGC,New Found Gold Corp Common Shares,$2.60,-0.17,-6.137%,516979869.00,,2021,687349,Basic Materials,Precious Metals
NG,Novagold Resources Inc.,$4.23,-0.13,-2.982%,1414641916.00,Canada,2003,873774,Basic Materials,Precious Metals
NGD,New Gold Inc.,$2.97,-0.14,-4.502%,2348082000.00,Canada,,11435381,Basic Materials,Metal Mining
NHC,National HealthCare Corporation Common Stock,$124.01,-1.79,-1.423%,3134352750.00,United States,1986,39472,Health Care,Hospital/Nursing Management
